"Thread ID","Title of Article","URL","Date and Time","Author Name","Content Description"
"1","Android’s new real-time app scanning aims to combat malicious sideloaded apps","https://techcrunch.com/2023/11/04/google-play-android-real-time-app-scanning-sideload-apps/","2023-11-04 12:20:56","Zack Whittaker,  Jagmeet Singh","Android’s in-built security engine Google Play Protect has a new feature that conducts a real-time analysis of an Android app’s code and blocks it from installing the app if it’s con"
"2","Remote connects talent and employers with a new job board","https://techcrunch.com/2023/11/15/remote-talent-job-board/","2023-11-15 07:00:16","Anna Heim","Remote, the HR tech company that allows companies to hire, manage and pay remote workers, is launching a remote job marketplace called Remote Talent. CEO and co-founder Job van der Voort said it seeme"
"4","Three human mistakes VCs often make, and how understanding them can help entrepreneurs fundraise better","https://techcrunch.com/2023/11/12/three-human-mistakes-vcs-often-make-and-how-understanding-them-can-help-entrepreneurs-fundraise-better/","2023-11-12 10:35:21","Alex Menn","The sheer number of non-economic mistakes made by VCs due to their human nature is seriously underestimated."
"3","Europe’s AI Act talks head for crunch point","https://techcrunch.com/2023/11/14/eu-ai-act-trilogue-crunch/","2023-11-14 09:56:53","Natasha Lomas","Negotiations between European Union lawmakers tasked with reaching a compromise on a risk-based framework for regulating applications of artificial intelligence appear to be on a tricky knife edge. Sp"
"4","Klarna’s and Affirm’s very good week","https://techcrunch.com/2023/11/12/klarna-and-affirms-very-good-week/","2023-11-12 10:25:18","Christine Hall,  Mary Ann Azevedo","Welcome back to The Interchange, where we take a look at the hottest fintech news of the previous week. If you want to receive The Interchange directly in your inbox every Sunday, head here to sign"
"3","YouTube adapts its policies for the coming surge of AI videos","https://techcrunch.com/2023/11/14/youtube-adapts-its-policies-for-the-coming-surge-of-ai-videos/","2023-11-14 09:49:13","Sarah Perez","YouTube today announced how it will approach handling AI-created content on its platform with a range of new policies surrounding responsible disclosure as well as new tools for requesting the removal"
"2","A comprehensive list of 2023 tech layoffs","https://techcrunch.com/2023/11/14/tech-layoffs-2023-list/","2023-11-14 14:45:20","Alyssa Stringer","Last year’s techwide reckoning continues. The tech industry has seen more than 240,000 jobs lost in 2023, a total that’s already 50% higher than last year and growing. Earlier this year, mass work"
"4","Deal Dive: BNPL expands beyond its roots — that’s a good thing","https://techcrunch.com/2023/11/11/qomodo-buy-now-pay-later/","2023-11-11 12:00:47","Rebecca Szkutak","There is a growing group of startups looking to expand the BNPL model into other categories."
"2","Use intellectual property to secure debt and equity-based funding","https://techcrunch.com/2023/11/14/use-intellectual-property-to-secure-debt-and-equity-based-funding/","2023-11-14 14:35:40","Keegan Caldwell","Keegan Caldwell Contributor Share on X Keegan Caldwell is the global managing partner and founder at Caldwell, a premier law firm specializing in high-growth technology and life sciences companies. C"
"2","TC+ Roundup: Is Getir’s most recent acquisition a sign of what’s to come?","https://techcrunch.com/2023/11/14/2628138/","2023-11-14 14:15:34","Karyne Levy","Fast-delivery startup Getir announced last week that it was buying FreshDirect, an online grocery delivery company."
"4","TC+ Roundup: Know your goals before taking the plunge","https://techcrunch.com/2023/11/10/tc-roundup-know-your-goals-before-taking-the-plunge/","2023-11-10 14:15:09","Karyne Levy","It’s not enough to just know your business model and potential TAM. You also have to consider your personal goals."
"2","Airbnb acquires secretive firm launched by Siri co-founder","https://techcrunch.com/2023/11/14/airbnb-acquires-secretive-firm-launched-by-siri-co-founder/","2023-11-14 12:59:05","Kyle Wiggers","Airbnb has acquired a secretive new AI startup, GamePlanner.AI, the company announced this morning. CNBC reports that the purchase price was around $200 million, a figure that TechCrunch was unable to"
